{
  "schemaVersion": 1,
  "artifactId": "01ARZ3NDEKTSV4RRFFQ69G5FAZ",
  "sourceId": "01ARZ3NDEKTSV4RRFFQ69G5FAY",
  "organizationId": "01ARZ3NDEKTSV4RRFFQ69G5FAV",
  "kind": "markdown",
  "objectKey": "org/01/published/source.md",
  "sha256": "bbbbbbbbbbbbbbbbbbbbbbbbbbbbbbbbbbbbbbbbbbbbbbbbbbbbbbbbbbbbbbbb",
  "mimeType": "text/markdown",
  "sizeBytes": 120,
  "parserVersion": "source-parser@1",
  "createdAt": "2026-08-16T08:00:00Z"
}
